{
  "$schema": "https://json-schema.org/draft/2020-12/schema",
  "$id": "https://asterion.local/schemas/operation/v1/operation-request-descriptor.schema.json",
  "title": "Asterion Operation Request Descriptor v1",
  "type": "object",
  "additionalProperties": false,
  "required": ["protocol", "request_kind", "request_ref", "request_sha256", "media_type", "byte_count", "purpose", "client_id", "session_id", "generation", "authority_revision"],
  "properties": {
    "protocol": {"const": "asterion.operation/v1"},
    "request_kind": {"$ref": "#/$defs/identifier"},
    "request_ref": {"$ref": "#/$defs/opaque_id"},
    "request_sha256": {"$ref": "#/$defs/sha256"},
    "media_type": {"$ref": "#/$defs/media_type"},
    "byte_count": {"$ref": "#/$defs/nonnegative_integer"},
    "purpose": {"$ref": "#/$defs/identifier"},
    "client_id": {"$ref": "#/$defs/opaque_id"},
    "session_id": {"$ref": "#/$defs/opaque_id"},
    "generation": {"$ref": "#/$defs/positive_integer"},
    "authority_revision": {"$ref": "#/$defs/positive_integer"}
  },
  "$defs": {
    "identifier": {"type": "string", "pattern": "^[a-z][a-z0-9]*(?:[.-][a-z0-9]+)*$"},
    "opaque_id": {"type": "string", "pattern": "^[A-Za-z0-9][A-Za-z0-9._:-]{0,127}$"},
    "sha256": {"type": "string", "pattern": "^[0-9a-f]{64}$"},
    "media_type": {"type": "string", "pattern": "^[a-z0-9][a-z0-9!#$&^_.+-]*/[a-z0-9][a-z0-9!#$&^_.+-]*$"},
    "nonnegative_integer": {"type": "integer", "minimum": 0, "maximum": 9007199254740991},
    "positive_integer": {"type": "integer", "minimum": 1, "maximum": 9007199254740991},
    "feature_id": {"enum": ["operation.auth", "operation.controlled-update-restart", "operation.doctor", "operation.model-selection", "operation.settings-keybindings", "operation.telemetry-usage"]}
  }
}
